{
  "table_id": "2015_vbt_unismoke_tables__2015_male_composite_alb",
  "table_identity": 3275,
  "source": "2015 VBT Unismoke Tables",
  "table": "2015 VBT Male Unismoke ALB",
  "family": "2015 vbt",
  "table_set": "vbt",
  "basis": "valuation_basic",
  "structure": "unismoke",
  "sex": "male",
  "smoker": "composite",
  "age_basis": "alb",
  "relative_risk_percent": 0,
  "shape": "select_and_ultimate",
  "year": 2015,
  "select_rates": {
    "0": {
      "1": 20,
      "2": 13,
      "3": 11,
      "4": 10,
      "5": 9,
      "6": 9,
      "7": 8,
      "8": 8,
      "9": 8,
      "10": 8,
      "11": 8,
      "12": 9,
      "13": 12,
      "14": 16,
      "15": 24,
      "16": 35,
      "17": 49,
      "18": 65,
      "19": 77,
      "20": 84,
      "21": 87,
      "22": 88,
      "23": 88,
      "24": 88,
      "25": 88
    },
    "1": {
      "1": 13,
      "2": 11,
      "3": 10,
      "4": 9,
      "5": 9,
      "6": 8,
      "7": 8,
      "8": 8,
      "9": 8,
      "10": 8,
      "11": 9,
      "12": 12,
      "13": 16,
      "14": 24,
      "15": 35,
      "16": 49,
      "17": 65,
      "18": 77,
      "19": 84,
      "20": 87,
      "21": 88,
      "22": 88,
      "23": 88,
      "24": 88,
      "25": 88
    },
    "2": {
      "1": 11,
      "2": 10,
      "3": 9,
      "4": 9,
      "5": 8,
      "6": 8,
      "7": 8,
      "8": 8,
      "9": 8,
      "10": 9,
      "11": 12,
      "12": 16,
      "13": 24,
      "14": 35,
      "15": 49,
      "16": 65,
      "17": 77,
      "18": 84,
      "19": 87,
      "20": 88,
      "21": 88,
      "22": 88,
      "23": 88,
      "24": 88,
      "25": 87
    },
    "3": {
      "1": 10,
      "2": 9,
      "3": 9,
      "4": 8,
      "5": 8,
      "6": 8,
      "7": 8,
      "8": 8,
      "9": 9,
      "10": 12,
      "11": 16,
      "12": 24,
      "13": 35,
      "14": 49,
      "15": 65,
      "16": 77,
      "17": 84,
      "18": 87,
      "19": 88,
      "20": 88,
      "21": 88,
      "22": 88,
      "23": 88,
      "24": 87,
      "25": 86
    },
    "4": {
      "1": 9,
      "2": 9,
      "3": 8,
      "4": 8,
      "5": 8,
      "6": 8,
      "7": 8,
      "8": 9,
      "9": 12,
      "10": 16,
      "11": 24,
      "12": 35,
      "13": 49,
      "14": 65,
      "15": 77,
      "16": 84,
      "17": 87,
      "18": 88,
      "19": 88,
      "20": 88,
      "21": 88,
      "22": 88,
      "23": 87,
      "24": 86,
      "25": 84
    },
    "5": {
      "1": 9,
      "2": 8,
      "3": 8,
      "4": 8,
      "5": 8,
      "6": 8,
      "7": 9,
      "8": 12,
      "9": 16,
      "10": 24,
      "11": 35,
      "12": 49,
      "13": 65,
      "14": 77,
      "15": 84,
      "16": 87,
      "17": 88,
      "18": 88,
      "19": 88,
      "20": 88,
      "21": 88,
      "22": 87,
      "23": 86,
      "24": 84,
      "25": 84
    },
    "6": {
      "1": 8,
      "2": 8,
      "3": 8,
      "4": 8,
      "5": 8,
      "6": 9,
      "7": 12,
      "8": 16,
      "9": 24,
      "10": 35,
      "11": 49,
      "12": 65,
      "13": 77,
      "14": 84,
      "15": 87,
      "16": 88,
      "17": 88,
      "18": 88,
      "19": 88,
      "20": 88,
      "21": 87,
      "22": 86,
      "23": 84,
      "24": 84,
      "25": 86
    },
    "7": {
      "1": 8,
      "2": 8,
      "3": 8,
      "4": 8,
      "5": 9,
      "6": 12,
      "7": 16,
      "8": 24,
      "9": 35,
      "10": 49,
      "11": 65,
      "12": 77,
      "13": 84,
      "14": 87,
      "15": 88,
      "16": 88,
      "17": 88,
      "18": 88,
      "19": 88,
      "20": 87,
      "21": 86,
      "22": 84,
      "23": 84,
      "24": 86,
      "25": 90
    },
    "8": {
      "1": 8,
      "2": 8,
      "3": 8,
      "4": 9,
      "5": 12,
      "6": 16,
      "7": 24,
      "8": 35,
      "9": 49,
      "10": 65,
      "11": 77,
      "12": 84,
      "13": 87,
      "14": 88,
      "15": 88,
      "16": 88,
      "17": 88,
      "18": 88,
      "19": 87,
      "20": 86,
      "21": 84,
      "22": 84,
      "23": 86,
      "24": 90,
      "25": 97
    },
    "9": {
      "1": 8,
      "2": 8,
      "3": 9,
      "4": 12,
      "5": 16,
      "6": 24,
      "7": 35,
      "8": 49,
      "9": 65,
      "10": 77,
      "11": 84,
      "12": 87,
      "13": 88,
      "14": 88,
      "15": 88,
      "16": 88,
      "17": 88,
      "18": 87,
      "19": 86,
      "20": 84,
      "21": 84,
      "22": 86,
      "23": 90,
      "24": 97,
      "25": 105
    },
    "10": {
      "1": 8,
      "2": 9,
      "3": 12,
      "4": 16,
      "5": 24,
      "6": 35,
      "7": 49,
      "8": 65,
      "9": 77,
      "10": 84,
      "11": 87,
      "12": 88,
      "13": 88,
      "14": 88,
      "15": 88,
      "16": 88,
      "17": 87,
      "18": 86,
      "19": 84,
      "20": 84,
      "21": 86,
      "22": 90,
      "23": 97,
      "24": 105,
      "25": 113
    },
    "11": {
      "1": 9,
      "2": 12,
      "3": 16,
      "4": 24,
      "5": 35,
      "6": 49,
      "7": 65,
      "8": 77,
      "9": 84,
      "10": 87,
      "11": 88,
      "12": 88,
      "13": 88,
      "14": 88,
      "15": 88,
      "16": 87,
      "17": 86,
      "18": 84,
      "19": 84,
      "20": 86,
      "21": 90,
      "22": 97,
      "23": 105,
      "24": 113,
      "25": 123
    },
    "12": {
      "1": 12,
      "2": 16,
      "3": 24,
      "4": 35,
      "5": 49,
      "6": 65,
      "7": 77,
      "8": 84,
      "9": 87,
      "10": 88,
      "11": 88,
      "12": 88,
      "13": 88,
      "14": 88,
      "15": 87,
      "16": 86,
      "17": 84,
      "18": 84,
      "19": 86,
      "20": 90,
      "21": 97,
      "22": 105,
      "23": 113,
      "24": 123,
      "25": 133
    },
    "13": {
      "1": 16,
      "2": 24,
      "3": 35,
      "4": 49,
      "5": 65,
      "6": 77,
      "7": 84,
      "8": 87,
      "9": 88,
      "10": 88,
      "11": 88,
      "12": 88,
      "13": 88,
      "14": 87,
      "15": 86,
      "16": 84,
      "17": 84,
      "18": 86,
      "19": 90,
      "20": 97,
      "21": 105,
      "22": 113,
      "23": 123,
      "24": 133,
      "25": 144
    },
    "14": {
      "1": 24,
      "2": 35,
      "3": 49,
      "4": 65,
      "5": 77,
      "6": 84,
      "7": 87,
      "8": 88,
      "9": 88,
      "10": 88,
      "11": 88,
      "12": 88,
      "13": 87,
      "14": 86,
      "15": 84,
      "16": 84,
      "17": 86,
      "18": 90,
      "19": 97,
      "20": 105,
      "21": 113,
      "22": 123,
      "23": 133,
      "24": 144,
      "25": 155
    },
    "15": {
      "1": 35,
      "2": 49,
      "3": 65,
      "4": 77,
      "5": 84,
      "6": 87,
      "7": 88,
      "8": 88,
      "9": 88,
      "10": 88,
      "11": 88,
      "12": 87,
      "13": 86,
      "14": 84,
      "15": 84,
      "16": 86,
      "17": 90,
      "18": 97,
      "19": 105,
      "20": 113,
      "21": 123,
      "22": 133,
      "23": 144,
      "24": 155,
      "25": 167
    },
    "16": {
      "1": 49,
      "2": 65,
      "3": 77,
      "4": 84,
      "5": 87,
      "6": 88,
      "7": 88,
      "8": 88,
      "9": 88,
      "10": 88,
      "11": 87,
      "12": 86,
      "13": 84,
      "14": 84,
      "15": 86,
      "16": 90,
      "17": 97,
      "18": 105,
      "19": 113,
      "20": 123,
      "21": 133,
      "22": 144,
      "23": 155,
      "24": 167,
      "25": 181
    },
    "17": {
      "1": 66,
      "2": 79,
      "3": 84,
      "4": 86,
      "5": 87,
      "6": 88,
      "7": 88,
      "8": 88,
      "9": 88,
      "10": 87,
      "11": 86,
      "12": 84,
      "13": 83,
      "14": 86,
      "15": 91,
      "16": 97,
      "17": 105,
      "18": 113,
      "19": 122,
      "20": 135,
      "21": 143,
      "22": 154,
      "23": 167,
      "24": 181,
      "25": 194
    },
    "18": {
      "1": 67,
      "2": 69,
      "3": 72,
      "4": 73,
      "5": 73,
      "6": 74,
      "7": 76,
      "8": 75,
      "9": 70,
      "10": 67,
      "11": 66,
      "12": 64,
      "13": 64,
      "14": 68,
      "15": 73,
      "16": 79,
      "17": 88,
      "18": 98,
      "19": 109,
      "20": 122,
      "21": 135,
      "22": 148,
      "23": 162,
      "24": 178,
      "25": 193
    },
    "19": {
      "1": 61,
      "2": 64,
      "3": 67,
      "4": 67,
      "5": 67,
      "6": 68,
      "7": 69,
      "8": 66,
      "9": 63,
      "10": 61,
      "11": 61,
      "12": 62,
      "13": 64,
      "14": 69,
      "15": 75,
      "16": 81,
      "17": 90,
      "18": 101,
      "19": 114,
      "20": 129,
      "21": 144,
      "22": 158,
      "23": 172,
      "24": 187,
      "25": 200
    },
    "20": {
      "1": 55,
      "2": 59,
      "3": 60,
      "4": 60,
      "5": 60,
      "6": 61,
      "7": 61,
      "8": 59,
      "9": 56,
      "10": 58,
      "11": 58,
      "12": 61,
      "13": 65,
      "14": 71,
      "15": 77,
      "16": 84,
      "17": 93,
      "18": 106,
      "19": 121,
      "20": 137,
      "21": 152,
      "22": 166,
      "23": 179,
      "24": 192,
      "25": 205
    },
    "21": {
      "1": 50,
      "2": 55,
      "3": 52,
      "4": 52,
      "5": 52,
      "6": 53,
      "7": 53,
      "8": 52,
      "9": 52,
      "10": 55,
      "11": 58,
      "12": 61,
      "13": 66,
      "14": 73,
      "15": 80,
      "16": 87,
      "17": 98,
      "18": 113,
      "19": 129,
      "20": 145,
      "21": 159,
      "22": 171,
      "23": 183,
      "24": 195,
      "25": 209
    },
    "22": {
      "1": 45,
      "2": 47,
      "3": 45,
      "4": 45,
      "5": 46,
      "6": 47,
      "7": 47,
      "8": 48,
      "9": 49,
      "10": 54,
      "11": 58,
      "12": 63,
      "13": 68,
      "14": 75,
      "15": 83,
      "16": 92,
      "17": 105,
      "18": 120,
      "19": 137,
      "20": 152,
      "21": 164,
      "22": 174,
      "23": 184,
      "24": 197,
      "25": 214
    },
    "23": {
      "1": 40,
      "2": 41,
      "3": 40,
      "4": 41,
      "5": 41,
      "6": 42,
      "7": 43,
      "8": 45,